{
    "allowCaching": false,
    "captureUserTraces": false,
    "userTracesStartAction": "",
    "userTracesEndAction": "",
    "userNeedsConfirmation": true,
    "alwaysForceLogin": false,
    "allowUploads": true,
    "defaultUserRole": "user",
    "theme": "",
    "defaultLanguage": "en",
    "videoFit": "contain",
    "overviewMode": "grid",
    "overviewTitle": "All Item Types",
    "overviewShowSearchBar": true,
    "userAvatars": "local",
    "lastchanged": 1791365400000
}
